{
  "artifacts": [
    "workspace/fake-task/research/findings.md"
  ],
  "completed": "Completed Inspect the fictional onboarding brief in the synthetic workflow.",
  "created_at": "2026-07-14T17:02:28.373737Z",
  "from_task": "inspect-fake-brief",
  "next_step": "Draft one bounded remediation plan for the identified onboarding risk.",
  "risks": [
    "Moonleaf and its onboarding problem are synthetic fixtures."
  ],
  "schema_version": 1
}
